{
  "claims": [
    {
      "command": ["roots-lineage.py", "compare", "--level", "complete_tree"],
      "evidence_digest": "sha1:572a31249e721dc1dac658ac65224010113503d1",
      "exclusions": [],
      "id": "roots-knots-29.3-complete-tree",
      "left": "roots-29.3-roots.1",
      "level": "complete_tree",
      "right": "knots-29.3.knots20260507",
      "scope": ["all Git tree entries, modes, and blob IDs"],
      "status": "different"
    },
    {
      "command": ["roots-lineage.py", "compare", "--level", "maintained_source"],
      "evidence_digest": "sha1:f3ae7a47fbd9e739c6335d7e8bc66fe96226e65e",
      "exclusions": ["doc/man/"],
      "id": "roots-knots-29.3-maintained-source",
      "left": "roots-29.3-roots.1",
      "level": "maintained_source",
      "right": "knots-29.3.knots20260507",
      "scope": ["classified maintained-source paths; validation-adjacent paths retained for manual invariant review"],
      "status": "different"
    },
    {
      "command": ["roots-lineage.py", "compare", "--level", "generated_release_artifact"],
      "evidence_digest": "sha1:19d1e65fb3543b14bfc916a685a0245c90b3fc3a",
      "exclusions": ["all non-generated-release-artifact records in roots-knots-29.3-classification.json"],
      "id": "roots-knots-29.3-generated-artifacts",
      "left": "roots-29.3-roots.1",
      "level": "generated_release_artifact",
      "right": "knots-29.3.knots20260507",
      "scope": ["six classified generated manpage paths"],
      "status": "different"
    },
    {
      "command": ["roots-lineage.py", "compare", "--level", "build_input"],
      "evidence_digest": "sha1:3f95597e9a3a72f945fdecfda4c3f2257fff10db",
      "exclusions": ["all non-build-input records in roots-knots-29.3-classification.json"],
      "id": "roots-knots-29.3-build-input",
      "left": "roots-29.3-roots.1",
      "level": "build_input",
      "right": "knots-29.3.knots20260507",
      "scope": ["55 classified build, CI, and packaging paths"],
      "status": "different"
    }
  ],
  "exceptions": [],
  "fork_starts": [
    {
      "commit": "sha1:07580114c35e870e242621316ec8cd051a938787",
      "id": "roots-first-fork-commit",
      "parent": "sha1:99ee26e9df0e63a5d1e0ab6bd46b1862ce67648b",
      "path_count": 40,
      "project": "roots",
      "relation": "direct-parent",
      "scope": "raw Git tree entries and blob/mode changes; no release identity or equivalence claim",
      "command": ["git", "diff", "--raw", "--no-renames", "--no-ext-diff", "99ee26e9df0e63a5d1e0ab6bd46b1862ce67648b", "07580114c35e870e242621316ec8cd051a938787"],
      "status_counts": {"added": 1, "deleted": 1, "modified": 38},
      "evidence_digest": "sha1:8fd706a2a4e2312080b004fbf8c39921fa6973b4",
      "tree": "sha1:dc7bf92745bff088d1c2b96b11f171256d4baa5c"
    }
  ],
  "object_format": "sha1",
  "releases": [
    {
      "id": "core-29.3",
      "object_format": "sha1",
      "parents": ["sha1:8de2549bda9eb0c4231b4636b4fcb42bad5dfc92", "sha1:c9a7bd90eb5a60657e68f33a03782f2a9ceefe86"],
      "peeled_commit": "sha1:99003bed87333f1be51bf3070235591b3a72f007",
      "project": "core",
      "release_label": "29.3",
      "refspec": "refs/tags/v29.3:refs/tags/v29.3",
      "repository": "https://github.com/bitcoin/bitcoin.git",
      "resolution_status": "resolved",
      "retrieval": "explicit-fetch-only",
      "signature": "unverified",
      "trust_status": "unverified",
      "tag": "v29.3",
      "tag_ref": "refs/tags/v29.3",
      "tag_object": "sha1:f2ca1bc7f94f1f662e2d7ee0858f2d90018bb863",
      "tree": "sha1:d7910bd5e9335128932f1f848a767d773895c4a4"
    },
    {
      "id": "knots-29.3.knots20260507",
      "depends_on": ["core-29.3"],
      "object_format": "sha1",
      "parents": ["sha1:4515e84b318c291d401358e65ae5e7d34b697f11", "sha1:a9aee730466ac67d35a3c03ee24676be5e045878"],
      "peeled_commit": "sha1:4bb7c0e8dbde2bd9478849a18d098598d2046914",
      "project": "knots",
      "release_label": "29.3.knots20260507",
      "refspec": "refs/tags/v29.3.knots20260507:refs/tags/v29.3.knots20260507",
      "repository": "https://github.com/bitcoinknots/bitcoin.git",
      "resolution_status": "resolved",
      "retrieval": "explicit-fetch-only",
      "signature": "unverified",
      "trust_status": "unverified",
      "tag": "v29.3.knots20260507",
      "tag_ref": "refs/tags/v29.3.knots20260507",
      "tag_object": "sha1:b44895edd1ab63b6bfed6ec85d8c1828d6514e9a",
      "tree": "sha1:373259b74b193235decd5d0faaace203108eb9cb"
    },
    {
      "id": "roots-29.3-roots.1",
      "object_format": "sha1",
      "parents": ["sha1:8e0bd0c054bd44d487a07556a0c423ee9e7b5634"],
      "peeled_commit": "sha1:42098b53c57fb6818736c7b6732fa84ffe6ad391",
      "project": "roots",
      "release_label": "29.3-roots.1",
      "refspec": "refs/tags/v29.3-roots.1:refs/tags/v29.3-roots.1",
      "repository": "https://github.com/LuganoPlanB/bitcoin-roots.git",
      "resolution_status": "resolved",
      "retrieval": "explicit-fetch-only",
      "signature": "unsigned",
      "tag": "v29.3-roots.1",
      "tag_object": "sha1:9b083fbac340b58ccf23c70d01958d62cd7eb79b",
      "tag_ref": "refs/tags/v29.3-roots.1",
      "tree": "sha1:a5708dcbf1d2611360fab68fc6a8e504db1ba95d",
      "trust_status": "not-available"
    }
  ],
  "schema_version": 1
}
